{
  "schemaVersion": "mimirShippingCatalogRelations.v1",
  "sourceCatalogSha256": "f2ea34810476db28d1583b84869ea6ef89c67fac66b61bee28a7568fbb16ad56",
  "canonicalIds": [
    "1292_advanced_programmable_video_system",
    "3ds",
    "acorn_archimedes",
    "acorn_atom",
    "acorn_bbc_micro",
    "acorn_risc_pc",
    "act_apricot_pc_xi",
    "amazon_fire_tv",
    "amazon_luna",
    "amstrad_cpc",
    "amstrad_gx4000",
    "apf_imagination_machine",
    "apf_mp_1000",
    "apple_bandai_pippin",
    "apple_i",
    "apple_ii",
    "apple_iie",
    "apple_iigs",
    "apple_macintosh",
    "arcade",
    "arduboy_inc_arduboy",
    "atari_2600",
    "atari_5200",
    "atari_7800",
    "atari_8_bit_family",
    "atari_jaguar",
    "atari_jaguar_cd",
    "atari_lynx",
    "atari_pong",
    "atari_st",
    "atari_vcs",
    "atari_xegs",
    "atomiswave",
    "bally_astrocade",
    "bandai_design_master_denshi_mangajuku",
    "bandai_gundam_rx_78",
    "bandai_playdia",
    "bandai_super_vision_8000",
    "bandai_terebikko",
    "bandai_wonderswan",
    "bandai_wonderswan_color",
    "bbc_bridge_companion",
    "benesse_pocket_challenge_v2",
    "benesse_pocket_challenge_w",
    "bit_corporation_gamate",
    "capcom_cp_system_i",
    "capcom_cp_system_ii",
    "capcom_cp_system_iii",
    "casio_loopy",
    "casio_pv_1000",
    "chip_8",
    "coleco_colecovision",
    "coleco_colecovision_adam",
    "coleco_telstar_6030",
    "coleco_telstar_6040",
    "coleco_telstar_6045",
    "coleco_telstar_6065",
    "coleco_telstar_6071",
    "coleco_telstar_6135",
    "commodore_128",
    "commodore_64",
    "commodore_amiga",
    "commodore_cd32",
    "commodore_cdtv",
    "commodore_pet",
    "commodore_plus_4",
    "commodore_vic_20",
    "connor_videosmarts",
    "digital_media_cartridge_firecore",
    "dos",
    "dreamcast",
    "ds",
    "emerson_arcadia_2001",
    "entex_adventure_vision",
    "entex_select_a_game",
    "epoch_cassette_vision",
    "epoch_game_pocket_computer",
    "epoch_super_cassette_vision",
    "epoch_tv_tennis_electrotennis",
    "fairchild_channel_f",
    "fujitsu_fm_7",
    "fujitsu_fm_towns",
    "fukutake_publishing_studybox",
    "funtech_super_acan",
    "gakken_compact_vision_tv_boy",
    "gamecube",
    "gamepark_caanoo",
    "gamepark_gp2x",
    "gamepark_gp32",
    "gb",
    "gba",
    "gbc",
    "gce_vectrex",
    "genesis",
    "google_nexus_player",
    "google_stadia",
    "handheld_electronic_game",
    "hartung_game_master",
    "hitachi_s1",
    "infocom_z_machine",
    "intellivision_amico",
    "interton_vc_4000",
    "interton_video_2000",
    "ique_ique",
    "konami_picno",
    "leapfrog_explorer",
    "leapfrog_leappad",
    "leapfrog_leapster_learning_game_system",
    "leapfrog_my_first_leappad",
    "ljn_video_art",
    "lowres_nx",
    "lutro",
    "luxor_abc_800",
    "magnavox_odyssey",
    "magnavox_odyssey2",
    "mattel_hyperscan",
    "mattel_intellivision",
    "microsoft_msx",
    "microsoft_msx2",
    "microsoft_xbox_one",
    "microsoft_xbox_series_x",
    "microw8",
    "milton_bradley_microvision",
    "n64",
    "nec_pc_98",
    "nec_pc_engine_cd_turbografx_cd",
    "nec_pc_engine_supergrafx",
    "nec_pc_engine_turbografx_16",
    "nec_pc_fx",
    "nes",
    "nichibutsu_my_vision",
    "nintendo_color_tv_game_ctg_15v",
    "nintendo_color_tv_game_ctg_6",
    "nintendo_color_tv_game_ctg_bk6",
    "nintendo_color_tv_game_ctg_cr112",
    "nintendo_color_tv_game_ctg_hc10",
    "nintendo_family_computer_disk_system",
    "nintendo_nintendo_64dd",
    "nintendo_nintendo_dsi",
    "nintendo_pokemon_mini",
    "nintendo_satellaview",
    "nintendo_sufami_turbo",
    "nintendo_virtual_boy",
    "nintendo_wii",
    "nintendo_wii_u",
    "nokia_n_gage",
    "nvidia_shield_portable",
    "nvidia_shield_tv",
    "ouya_ouya",
    "palmtex_super_micro",
    "panic_playdate",
    "pc_50x_palladium_tele_cassetten_game_825_530",
    "pc_50x_palladium_tele_cassetten_game_825_581",
    "pc_50x_shg_black_point_fs_1003",
    "philips_cd_i",
    "philips_tele_game",
    "philips_videopac",
    "pioneer_laseractive",
    "playjam_game_stick",
    "ps1",
    "ps2",
    "ps3",
    "psp",
    "rca_studio_ii",
    "rpg_maker",
    "saturn",
    "scummvm",
    "sega_32x",
    "sega_beena",
    "sega_chihiro",
    "sega_game_gear",
    "sega_master_system_mark_iii",
    "sega_mega_cd_sega_cd",
    "sega_naomi",
    "sega_naomi_2",
    "sega_pico",
    "sega_sg_1000",
    "sega_video_driver",
    "sharp_x1",
    "sharp_x68000",
    "sinclair_zx_81",
    "sinclair_zx_spectrum",
    "snes",
    "snk_neo_geo",
    "snk_neo_geo_cd",
    "snk_neo_geo_pocket",
    "snk_neo_geo_pocket_color",
    "sony_playstation_4",
    "sony_playstation_5",
    "sony_playstation_vita",
    "spectravideo_sv",
    "ssd_xavixport",
    "switch",
    "takara_video_challenger",
    "tandy_video_information_system",
    "tapwave_zodiac",
    "the_3do_company_3do",
    "thomson_moto",
    "tic_80",
    "tiger_game_com",
    "tiger_gizmondo",
    "tiger_r_zone",
    "tomy_tutor",
    "umtech_videobrain",
    "unisonic_champion_2711",
    "uzebox",
    "valve_steam_deck",
    "valve_steam_link",
    "view_master_interactive_vision",
    "vircon32",
    "vm_labs_nuon",
    "vtech_3d_gamate",
    "vtech_creativision",
    "vtech_socrates",
    "vtech_v_flash",
    "vtech_v_smile",
    "wasm_4",
    "watara_supervision",
    "welback_mega_duck",
    "worlds_of_wonder_action_max",
    "xbox",
    "xbox360",
    "yamaha_copera",
    "zapit_game_wave",
    "zeebo_zeebo"
  ],
  "variantLinks": [
    {
      "catalogId": "acorn_atom_tapes",
      "platformId": "acorn_atom",
      "relation": "CONTENT_VARIANT"
    },
    {
      "catalogId": "amazon_fire_tv_2nd_gen",
      "platformId": "amazon_fire_tv",
      "relation": "HARDWARE_VARIANT"
    },
    {
      "catalogId": "amazon_fire_tv_3rd_gen",
      "platformId": "amazon_fire_tv",
      "relation": "HARDWARE_VARIANT"
    },
    {
      "catalogId": "amazon_fire_tv_cube",
      "platformId": "amazon_fire_tv",
      "relation": "HARDWARE_VARIANT"
    },
    {
      "catalogId": "apple_i_tapes",
      "platformId": "apple_i",
      "relation": "CONTENT_VARIANT"
    },
    {
      "catalogId": "apple_ii_plus",
      "platformId": "apple_ii",
      "relation": "HARDWARE_VARIANT"
    },
    {
      "catalogId": "apple_macintosh_beta",
      "platformId": "apple_macintosh",
      "relation": "CONTENT_VARIANT"
    },
    {
      "catalogId": "atari_2600_637_75000",
      "platformId": "atari_2600",
      "relation": "HARDWARE_VARIANT"
    },
    {
      "catalogId": "atari_2600_cx2600a",
      "platformId": "atari_2600",
      "relation": "HARDWARE_VARIANT"
    },
    {
      "catalogId": "atari_2600_cx2600jr",
      "platformId": "atari_2600",
      "relation": "HARDWARE_VARIANT"
    },
    {
      "catalogId": "atari_2600_cx2700",
      "platformId": "atari_2600",
      "relation": "HARDWARE_VARIANT"
    },
    {
      "catalogId": "atari_2600_flashback",
      "platformId": "atari_2600",
      "relation": "HARDWARE_VARIANT"
    },
    {
      "catalogId": "atari_2600_flashback_2",
      "platformId": "atari_2600",
      "relation": "HARDWARE_VARIANT"
    },
    {
      "catalogId": "atari_lynx_pag_0401",
      "platformId": "atari_lynx",
      "relation": "HARDWARE_VARIANT"
    },
    {
      "catalogId": "atari_pong_c_140",
      "platformId": "atari_pong",
      "relation": "HARDWARE_VARIANT"
    },
    {
      "catalogId": "atari_pong_c_200",
      "platformId": "atari_pong",
      "relation": "HARDWARE_VARIANT"
    },
    {
      "catalogId": "atari_st_tapes",
      "platformId": "atari_st",
      "relation": "CONTENT_VARIANT"
    },
    {
      "catalogId": "bally_astrocade_tapes",
      "platformId": "bally_astrocade",
      "relation": "CONTENT_VARIANT"
    },
    {
      "catalogId": "bandai_wonderswan_color_wsc_001",
      "platformId": "bandai_wonderswan_color",
      "relation": "HARDWARE_VARIANT"
    },
    {
      "catalogId": "commodore_64_64c",
      "platformId": "commodore_64",
      "relation": "HARDWARE_VARIANT"
    },
    {
      "catalogId": "commodore_64_games_system",
      "platformId": "commodore_64",
      "relation": "HARDWARE_VARIANT"
    },
    {
      "catalogId": "commodore_64_pp",
      "platformId": "commodore_64",
      "relation": "CONTENT_VARIANT"
    },
    {
      "catalogId": "commodore_64_tapes",
      "platformId": "commodore_64",
      "relation": "CONTENT_VARIANT"
    },
    {
      "catalogId": "digital_media_cartridge_firecore_portable_2",
      "platformId": "digital_media_cartridge_firecore",
      "relation": "HARDWARE_VARIANT"
    },
    {
      "catalogId": "epoch_cassette_vision_jr",
      "platformId": "epoch_cassette_vision",
      "relation": "HARDWARE_VARIANT"
    },
    {
      "catalogId": "fairchild_channel_f_system_ii",
      "platformId": "fairchild_channel_f",
      "relation": "HARDWARE_VARIANT"
    },
    {
      "catalogId": "fbneo_arcade_games",
      "platformId": "arcade",
      "relation": "CONTENT_VARIANT"
    },
    {
      "catalogId": "fujitsu_fm_7_tapes",
      "platformId": "fujitsu_fm_7",
      "relation": "CONTENT_VARIANT"
    },
    {
      "catalogId": "fujitsu_fm_towns_marty",
      "platformId": "fujitsu_fm_towns",
      "relation": "HARDWARE_VARIANT"
    },
    {
      "catalogId": "gamepark_gp2x_digital",
      "platformId": "gamepark_gp2x",
      "relation": "CONTENT_VARIANT"
    },
    {
      "catalogId": "gamepark_gp2x_f200",
      "platformId": "gamepark_gp2x",
      "relation": "HARDWARE_VARIANT"
    },
    {
      "catalogId": "gamepark_gp2x_wiz",
      "platformId": "gamepark_gp2x",
      "relation": "HARDWARE_VARIANT"
    },
    {
      "catalogId": "hbmame",
      "platformId": "arcade",
      "relation": "CONTENT_VARIANT"
    },
    {
      "catalogId": "leapfrog_leapster_learning_game_system_1",
      "platformId": "leapfrog_leapster_learning_game_system",